<?xml version="1.0" encoding="UTF-8"?>
<?xml-stylesheet type="text/xsl" href="catalog.xsl"?>
<catalog
  xmlns="http://www.w3school.com.cn"
  xmlns:xsi="http://www.w3.org/2001/XMLSchema-instance"
  xsi:schemaLocation="http://www.w3school.com.cn catalog.xsd">
	<cd>
		<title>Empire Burlesque</title>
		<artist>Bob Dylan</artist>
		<country>USA</country>
		<company>Columbia</company>
        <price>10.90</price>
		<year>1985</year>
	</cd>
</catalog>